{
  "schema": 1,
  "captured_on": "2026-09-21",
  "catalog_source_revision": "046414eec9315eb1500f2e68147aa281ab35873d",
  "sources": [
    {
      "id": "forge-preset-first-adventure",
      "family": "forge-preset",
      "label": "First Adventure",
      "input": "Infinity Mod Forge data/presets.json",
      "input_sha256": "9205bcc6880b514ade5249bb2b1179f7909cd8390e68a85f988c79a9d107769d",
      "deduplication_key": "forge-preset:first-adventure",
      "counts_toward_coverage": true,
      "selections": [
        3,
        4,
        5,
        12,
        13,
        16,
        18,
        24,
        25,
        29,
        62,
        247,
        449,
        685,
        701
      ]
    },
    {
      "id": "forge-preset-seasoned-adventurer",
      "family": "forge-preset",
      "label": "Seasoned Adventurer",
      "input": "Infinity Mod Forge data/presets.json",
      "input_sha256": "9205bcc6880b514ade5249bb2b1179f7909cd8390e68a85f988c79a9d107769d",
      "deduplication_key": "forge-preset:seasoned-adventurer",
      "counts_toward_coverage": true,
      "selections": [
        3,
        4,
        5,
        7,
        8,
        12,
        13,
        16,
        18,
        24,
        25,
        29,
        33,
        35,
        36,
        37,
        47,
        49,
        50,
        51,
        55,
        57,
        62,
        63,
        64,
        66,
        80,
        81,
        82,
        86,
        109,
        126,
        134,
        168,
        175,
        204,
        207,
        208,
        212,
        213,
        214,
        215,
        219,
        220,
        221,
        222,
        229,
        230,
        233,
        234,
        235,
        236,
        238,
        246,
        247,
        428,
        437,
        449,
        470,
        471,
        473,
        474,
        512,
        685,
        701
      ]
    },
    {
      "id": "forge-preset-veterans-challenge",
      "family": "forge-preset",
      "label": "Veteran's Challenge",
      "input": "Infinity Mod Forge data/presets.json",
      "input_sha256": "9205bcc6880b514ade5249bb2b1179f7909cd8390e68a85f988c79a9d107769d",
      "deduplication_key": "forge-preset:veterans-challenge",
      "counts_toward_coverage": true,
      "selections": [
        3,
        4,
        5,
        7,
        8,
        12,
        13,
        16,
        18,
        24,
        25,
        29,
        33,
        35,
        36,
        37,
        40,
        41,
        42,
        43,
        44,
        46,
        47,
        49,
        50,
        51,
        55,
        57,
        62,
        63,
        64,
        66,
        76,
        78,
        79,
        80,
        81,
        82,
        83,
        86,
        87,
        88,
        89,
        90,
        91,
        92,
        93,
        94,
        95,
        96,
        109,
        110,
        111,
        126,
        134,
        140,
        142,
        166,
        167,
        168,
        174,
        175,
        204,
        207,
        208,
        212,
        213,
        214,
        215,
        219,
        220,
        221,
        222,
        229,
        230,
        232,
        233,
        234,
        235,
        236,
        237,
        238,
        242,
        246,
        247,
        252,
        265,
        266,
        273,
        292,
        311,
        320,
        326,
        331,
        341,
        386,
        390,
        428,
        437,
        449,
        458,
        460,
        463,
        470,
        471,
        472,
        473,
        474,
        512,
        589,
        591,
        600,
        685,
        701
      ]
    },
    {
      "id": "iepm-reference-a7-hgo-managed",
      "family": "iepm-reference",
      "label": "a7-hgo-managed",
      "input": "IEPM checked-in example manifest",
      "input_sha256": "a07639ef67da89aa34ee1dee7fd327cce1fca2e9f12fcfb697a550db30239bdf",
      "deduplication_key": "iepm-reference:a07639ef67da89aa34ee1dee7fd327cce1fca2e9f12fcfb697a550db30239bdf",
      "counts_toward_coverage": false,
      "selections": [
        374
      ]
    },
    {
      "id": "iepm-reference-bg2ee-bubbs-spell-menu",
      "family": "iepm-reference",
      "label": "bg2ee-bubbs-spell-menu",
      "input": "IEPM checked-in example manifest",
      "input_sha256": "ef785f827c422904c4e9f99af64ef351105bb99665aaaa418d92be288c55c5aa",
      "deduplication_key": "iepm-reference:ef785f827c422904c4e9f99af64ef351105bb99665aaaa418d92be288c55c5aa",
      "counts_toward_coverage": false,
      "selections": [
        20,
        21
      ]
    },
    {
      "id": "iepm-reference-bg2ee-content-starter",
      "family": "iepm-reference",
      "label": "bg2ee-content-starter",
      "input": "IEPM checked-in example manifest",
      "input_sha256": "f92491c41c1e36e839d78e7b18bbe7065deb06581b1134a38d3ce379587f19ea",
      "deduplication_key": "iepm-reference:f92491c41c1e36e839d78e7b18bbe7065deb06581b1134a38d3ce379587f19ea",
      "counts_toward_coverage": false,
      "selections": [
        103,
        109,
        506
      ]
    },
    {
      "id": "iepm-reference-bg2ee-eeex-core",
      "family": "iepm-reference",
      "label": "bg2ee-eeex-core",
      "input": "IEPM checked-in example manifest",
      "input_sha256": "3d1e5681ed1a99c22341b324c35167e89478778aaa943bf7f7a47ec3720e91e6",
      "deduplication_key": "iepm-reference:3d1e5681ed1a99c22341b324c35167e89478778aaa943bf7f7a47ec3720e91e6",
      "counts_toward_coverage": false,
      "selections": [
        20
      ]
    },
    {
      "id": "iepm-reference-bg2ee-infinity-ui",
      "family": "iepm-reference",
      "label": "bg2ee-infinity-ui",
      "input": "IEPM checked-in example manifest",
      "input_sha256": "b23da2a5e2c84388062f584a9492daf16d17ea3a89a3a40b75cdea3a4a4a6a88",
      "deduplication_key": "iepm-reference:b23da2a5e2c84388062f584a9492daf16d17ea3a89a3a40b75cdea3a4a4a6a88",
      "counts_toward_coverage": false,
      "selections": [
        17,
        20
      ]
    },
    {
      "id": "iepm-reference-bg2ee-popular-starter",
      "family": "iepm-reference",
      "label": "bg2ee-popular-starter",
      "input": "IEPM checked-in example manifest",
      "input_sha256": "262728a0127c6d50936e948ef91125133ad0e2a82f1a7d7f653da5a7fcdd3283",
      "deduplication_key": "iepm-reference:262728a0127c6d50936e948ef91125133ad0e2a82f1a7d7f653da5a7fcdd3283",
      "counts_toward_coverage": false,
      "selections": [
        288,
        292,
        311,
        374
      ]
    },
    {
      "id": "iepm-reference-bg2ee-scs-starter",
      "family": "iepm-reference",
      "label": "bg2ee-scs-starter",
      "input": "IEPM checked-in example manifest",
      "input_sha256": "6282a4198117db27184824e07a07a60e5256f19ba36238ff8100acb45e3d4919",
      "deduplication_key": "iepm-reference:6282a4198117db27184824e07a07a60e5256f19ba36238ff8100acb45e3d4919",
      "counts_toward_coverage": false,
      "selections": [
        341
      ]
    },
    {
      "id": "iepm-reference-bg2ee-tweaks-forge",
      "family": "iepm-reference",
      "label": "bg2ee-tweaks-forge",
      "input": "IEPM checked-in example manifest",
      "input_sha256": "156c027f47ef9d919197f567577c0c482892d5e94036d3317204e1a5cd1eaabc",
      "deduplication_key": "iepm-reference:156c027f47ef9d919197f567577c0c482892d5e94036d3317204e1a5cd1eaabc",
      "counts_toward_coverage": false,
      "selections": [
        247
      ]
    },
    {
      "id": "iepm-reference-bg2ee-tweaks-starter",
      "family": "iepm-reference",
      "label": "bg2ee-tweaks-starter",
      "input": "IEPM checked-in example manifest",
      "input_sha256": "b25de685e70d25108335fac27e76ab1a6a0d73e5b5ab093d86ebc32a48ed5a89",
      "deduplication_key": "iepm-reference:b25de685e70d25108335fac27e76ab1a6a0d73e5b5ab093d86ebc32a48ed5a89",
      "counts_toward_coverage": false,
      "selections": [
        247
      ]
    },
    {
      "id": "iepm-reference-eet-balanced",
      "family": "iepm-reference",
      "label": "eet-balanced",
      "input": "IEPM checked-in example manifest",
      "input_sha256": "565f1f1c6830f8228d9e9b10c5cf2e9fecfaf880a371b8b2b2bc8ce9ed530d3e",
      "deduplication_key": "iepm-reference:565f1f1c6830f8228d9e9b10c5cf2e9fecfaf880a371b8b2b2bc8ce9ed530d3e",
      "counts_toward_coverage": false,
      "selections": [
        12,
        17,
        20,
        21,
        109,
        247,
        374,
        386,
        449
      ]
    },
    {
      "id": "iepm-reference-eet-minimal",
      "family": "iepm-reference",
      "label": "eet-minimal",
      "input": "IEPM checked-in example manifest",
      "input_sha256": "42f187d7fe2b0a35c5cb1c65273a876e4386d29cf60face0e7587799dcaf0e1d",
      "deduplication_key": "iepm-reference:42f187d7fe2b0a35c5cb1c65273a876e4386d29cf60face0e7587799dcaf0e1d",
      "counts_toward_coverage": false,
      "selections": [
        3,
        4,
        12,
        449
      ]
    },
    {
      "id": "iepm-reference-forge-coverage",
      "family": "iepm-reference",
      "label": "forge-coverage",
      "input": "IEPM checked-in example manifest",
      "input_sha256": "6a116a891b713cb8db1182bdd250b0c77c76a838ad4b6f461351c33082d6b342",
      "deduplication_key": "iepm-reference:6a116a891b713cb8db1182bdd250b0c77c76a838ad4b6f461351c33082d6b342",
      "counts_toward_coverage": false,
      "selections": [
        3,
        4,
        12,
        17,
        20,
        21,
        103,
        109,
        247,
        341,
        374,
        449,
        506
      ]
    },
    {
      "id": "iepm-reference-hidden-gameplay-options-a5",
      "family": "iepm-reference",
      "label": "hidden-gameplay-options-a5",
      "input": "IEPM checked-in example manifest",
      "input_sha256": "a8dcf4c1287569e8a4e68bbcdbb30118b2f76a5f310cff5c0f9c9bd59741c62e",